{
  "$schema": "https://json-schema.org/draft/2020-12/schema",
  "$id": "ace://schemas/tasks.schema.json",
  "title": "ACE Task Queue (docs/progress/tasks.json)",
  "description": "File-based task state machine mandated by the Harness Engineering Standard (.ace/standards/harness-engineering.md, section 2) and driven by the `ace loop` orchestrator. The queue is the single source of truth for work state across context-flushed agent sessions. Loop invariants not expressible in JSON Schema: (1) at most one task may have status 'in_progress' at any time; (2) a task is eligible for pickup only when every id in depends_on has status 'verified'; (3) 'attempts' never exceeds 'max_attempts' (task-level, else defaults.max_attempts) — when the budget is exhausted, or the same failure fingerprint occurs twice consecutively (stall detection), the orchestrator must transition the task to 'blocked' and halt for human escalation; (4) no task may depend on itself, directly or transitively.",
  "type": "object",
  "required": ["version", "plan_ref", "updated", "defaults", "tasks"],
  "additionalProperties": false,
  "properties": {
    "version": {
      "description": "Schema version of this file, independent of the framework version.",
      "type": "string",
      "const": "1.0"
    },
    "plan_ref": {
      "description": "Relative path to the approved implementation plan this queue was generated from.",
      "type": "string",
      "pattern": "^docs/planning/.+\\.md$"
    },
    "created": {
      "type": "string",
      "format": "date-time"
    },
    "updated": {
      "description": "Set by the orchestrator on every state transition.",
      "type": "string",
      "format": "date-time"
    },
    "defaults": {
      "description": "Queue-wide defaults; individual tasks may override.",
      "type": "object",
      "required": ["max_attempts", "runner"],
      "additionalProperties": false,
      "properties": {
        "max_attempts": {
          "description": "Retry budget per task before forced escalation to 'blocked'.",
          "type": "integer",
          "minimum": 1,
          "maximum": 10,
          "default": 3
        },
        "runner": {
          "description": "Runner adapter used to spawn a fresh agent session per attempt. 'manual' prints the assembled prompt and waits for a human-driven session.",
          "type": "string",
          "examples": ["claude-code", "manual"]
        },
        "verify_cmd": {
          "description": "Command that must exit 0 for a task to be marked 'verified'. Defaults to '.ace/scripts/verify.sh' when omitted.",
          "type": "string"
        }
      }
    },
    "tasks": {
      "type": "array",
      "minItems": 1,
      "items": { "$ref": "#/$defs/task" }
    }
  },
  "$defs": {
    "task": {
      "type": "object",
      "required": ["id", "name", "objective", "status", "attempts", "depends_on"],
      "additionalProperties": false,
      "properties": {
        "id": {
          "description": "Stable task identifier, unique within the queue. Also names the progress log: docs/progress/task_<id>_result.md.",
          "type": "string",
          "pattern": "^T[0-9]{3}$"
        },
        "name": {
          "type": "string",
          "minLength": 3
        },
        "objective": {
          "description": "What is observably true when this task is done. Written for a Generator that has no conversation history.",
          "type": "string",
          "minLength": 20
        },
        "status": {
          "description": "pending: not started. in_progress: a Generator session owns it (max one queue-wide). verified: acceptance_cmd/verify_cmd exited 0 and result file written. failed: last attempt failed, retry budget remains. blocked: budget exhausted or stall detected — requires human action. skipped: descoped by the Architect (reason in notes).",
          "type": "string",
          "enum": ["pending", "in_progress", "verified", "failed", "blocked", "skipped"]
        },
        "role": {
          "description": "Role prompt loaded into the fresh session for this task.",
          "type": "string",
          "default": "Developer",
          "examples": ["Developer", "QA Engineer", "Incident Responder"]
        },
        "files": {
          "type": "object",
          "additionalProperties": false,
          "properties": {
            "create": { "type": "array", "items": { "type": "string" } },
            "modify": { "type": "array", "items": { "type": "string" } }
          }
        },
        "depends_on": {
          "description": "Task ids that must be 'verified' before this task is eligible. Empty array means no dependencies.",
          "type": "array",
          "items": { "type": "string", "pattern": "^T[0-9]{3}$" },
          "uniqueItems": true
        },
        "complexity": {
          "type": "string",
          "enum": ["S", "M", "L"]
        },
        "acceptance_cmd": {
          "description": "Task-specific verification command; overrides defaults.verify_cmd. Must exit 0.",
          "type": "string"
        },
        "attempts": {
          "description": "Number of Generator sessions consumed by this task so far.",
          "type": "integer",
          "minimum": 0
        },
        "max_attempts": {
          "description": "Overrides defaults.max_attempts for this task.",
          "type": "integer",
          "minimum": 1,
          "maximum": 10
        },
        "result_file": {
          "description": "Progress log written by the Generator on completion; the memory handed to the next agent.",
          "type": "string",
          "pattern": "^docs/progress/task_T[0-9]{3}_result\\.md$"
        },
        "failures": {
          "description": "One entry per failed attempt, consumed by the Reflector and by stall detection.",
          "type": "array",
          "items": { "$ref": "#/$defs/failure" }
        },
        "blocked_reason": {
          "description": "Required when status is 'blocked'. Why the loop halted and what the human must decide.",
          "type": "string",
          "minLength": 10
        },
        "notes": {
          "type": "string"
        }
      },
      "allOf": [
        {
          "if": { "properties": { "status": { "const": "blocked" } }, "required": ["status"] },
          "then": { "required": ["blocked_reason"], "properties": { "blocked_reason": { "type": "string" } } }
        },
        {
          "if": { "properties": { "status": { "const": "verified" } }, "required": ["status"] },
          "then": { "required": ["result_file"], "properties": { "result_file": { "type": "string" } } }
        },
        {
          "if": { "properties": { "status": { "enum": ["in_progress", "verified", "failed"] } }, "required": ["status"] },
          "then": { "properties": { "attempts": { "type": "integer", "minimum": 1 } } }
        }
      ]
    },
    "failure": {
      "type": "object",
      "required": ["at", "summary", "fingerprint"],
      "additionalProperties": false,
      "properties": {
        "at": {
          "type": "string",
          "format": "date-time"
        },
        "summary": {
          "description": "One-paragraph natural-language description of what failed, written by the orchestrator from the verify output.",
          "type": "string"
        },
        "fingerprint": {
          "description": "Normalized identity of the failure (e.g., sha256 of the failing test names + first error line, lowercased, paths stripped). Two consecutive identical fingerprints on one task = stall; the orchestrator must transition the task to 'blocked' instead of retrying.",
          "type": "string",
          "pattern": "^[a-f0-9]{12,64}$"
        },
        "trace_ref": {
          "description": "Path to the full execution/verify trace for the Reflector.",
          "type": "string"
        }
      }
    }
  }
}
